Sentinelle	Le Partenaire du personnage réduit les dégâts physiques qu'il subit de 1.
Soins	Fabriquer des trousses de soins demande désormais 10 minutes au lieu de 15. De plus, le personnage peut dépenser 3 PE lors de l'application d'une trousse pour soigner la cible de 9 PV supplémentaires.
Spiritisme	Le personnge peut voir les esprits et peut communiquer avec eux. Les esprits ne sont pas forcément amicaux ou coopératifs, cependant.
Stabilité	1 PE: Le personnage entre dans une posture de combat stable qui l'empêche de perdre pied. Pendant la durée de sa posture, le personnage est immunisé aux effets de Renverse et de Projection. Ceci est une posture de combat.
Stabilité	1 PE: Le personnage entre dans une posture de combat stable qui l'empêche de perdre pied. Pendant la durée de sa posture, le personnage est immunisé aux effets de Renverse et de Projection. Ceci est une posture de combat.
Stase	2 PE: Le personnage canalise l'arcane dans une frappe paralysante. Le personnage peut utiliser son Coup puissant pour infliger un effet de Paralysie (10 secondes). La frappe n'inflige aucun dégâts. Ceci est une compétence de combat. 
Supériorité	Les Coup puissants du personnage et de ses alliées effectués avec les PE temporaires conférés par Entraînement infligent +1 dégâts. (Pour un total de +2)
Surpuissance	Si un Coup puissant ou une compétence de Coup puissant du personnage est ignorée ou résistée, le personnage récupère les PE dépensés.
Survie	Une fois par jour, le personnage peut récupérer 1 PV à tout moment lors de sa période d'inconscience. Le personnage peut utiliser cette compétence pour éviter de se faire achever.
Tactiques	Utiliser Coup puissant permet au Partenaire d'utiliser Coup puissant immédiatement et gratuitement contre la même cible.
Talent	1 PE: Le personnage peux toucher une cible et lui infliger un effet de Charme (10 secondes).  De plus, le personnage sait parler le Bardique.
Témérité	Les effets de Hymne durent pendant 1 minute après que le personnage cesse de chanter.
Tempête	Orage affecte une cible différente de plus et inflige 1 dégât supplémentaire.
Thésaurus	Deux fois par jour, le personnage peut fouiller dans ses livres afin d'identifier un objet ainsi que ses effets si l'objet en possède. Certains objets sont particulièrement difficiles et inscrutables et demandent des connaissances plus approfondies afin de les identifier. Le personnage doit faire affaire avec l'Équipe Scénaristique afin de savoir ce qu'il découvre.
Tir de précision	Le personnage peut utiliser des compétences de Coup puissant avec des armes de lancer et à distance.
Tir explosif	Le personnage peut dépenser 3 de ses projectiles fabriqués pour infliger 3 dégâts de Feu dans un rayon de 3 mètres autour de son projectile.
Tir fantôme	1 PE: En dépensant un de ses projectiles fabriqués, le personnage peut lancer un tir fantômatique qui touche assurément la cible. Tir fantôme inflige 3 dégâts Physiques à une cible à portée directe. Tir fantôme peut bénéficier de Pointe primordiale ou de Pointe magique. (Le personnage doit mimer d'utiliser son arme à distance en utilisant Tir fantôme.)
Tir rapide	Utiliser Disparition donne instantannément un projectile fabriqué au personnage.
Torture	Au bout de 10 minutes de questionnement accompagné de techniques de persuasion, le personnage peut poser une question à sa cible. Celle-ci doit répondre au mieux de ses connaissances.
Totem	Le personnage gagne 2 points de vie temporaires tant qu'il porte de l'armure légère ou aucune armure. Ces points de vie temporaires se régénèrent après 10 minutes passées hors combat.  Le personnage ne bénéficie pas du bonus de Totem s'il porte de l'armure lourde. Le totem doit être préalablement approuvé par l'Équipe Scénaristique.
Trahison	(Cette compétence de coûte pas d'expérience à acquérir.) Le personnage accède à une version sacrilège de la Conjuration. Trahir ses pactes peut cependant avoir de graves conséquences...
Tranquilité	Berceuse peut affecter toutes les cibles dans un rayon de 1 mètre autour du personnage pour 2 PE au lieu de 1. Les cibles affectées par Berceuse récupèrent un point de vie à chaque minute pendant la durée. L'effet affecte uniquement les cibles présentes dans la zone à l'activation de la compétence.
Traque	Le personnage est immunisé aux effets de Charme, de Suggestion et de Peur infligés par sa proie.
Versatilité	Le personnage acquérit une compétence 'À l'achat' ("Tier 0") d'un autre arbre de compétence. Le personnage ne peut pas choisir un compétence d'un arbre qu'il possède déjà et ne peut pas choisir une compétence de magie.
Vertue	Une fois par jour, le personnage peut toucher une créature et la guérir d'un montant de PV égal aux PV maximum du personnage.
Vétéran	Si un adversaire frappe la cible de Garde du corps, le personnage augmente ses dommages de 1 contre cet adversaire pour la durée du combat. Ce bonus ne se cumule pas plus d'une fois par adversaire.
Victorieux	Le personnage récupère son usage quotidien de Duel s'il en sort victorieux.
Vie d'agonie	Tant que le personnage a au moins deux blessures, les Coups puissants et les compétences de Coup puissant du personnage infligent +1 dégâts. (Les compétences de Coup puissant du personnage qui n'infligent pas de dégâts restent identiques.)
Vie de souffrance	Subir une deuxième blessure durant un événement retire le besoin de se mutiler pour Régal de la douleur.
Vigueur divine	Toucher une cible avec Pénitence redonne 1 PE au personnage.
Violence	Pendant la durée de Rage, le personnage inflige 1 dégâts supplémentaire avec Coup puissant.
Vivacité	Le personnage peut désormais utiliser son Esquive pour éviter un sort qui le cible lui uniquement (Toucher, catalyseur ou portée directe).